{"protocol":"rdcp/1.0","timestamp":"2025-09-17T10:30:00.000Z","action":"enable","categories":["DATABASE"],"status":"success","message":"Enabled categories","changes":[{"category":"DATABASE","previousState":false,"newState":true,"temporary":true,"effectiveAt":"2025-09-17T10:30:00.000Z","expiresAt":"2025-09-17T10:45:00.000Z"}]}
